{
  "protocol": "tessera.ipc",
  "majorVersion": 1,
  "minorVersion": 0,
  "kind": "request",
  "id": "req-hello-range",
  "method": "system.hello",
  "params": {
    "clientName": "tessera-future-client",
    "clientVersion": "1.2.0",
    "minMajor": 1,
    "maxMajor": 1,
    "minMinor": 0,
    "maxMinor": 2,
    "requestedCapabilities": ["state.inspect"]
  }
}
